[
  {
    "id": "aircraft-commander-operates-c17",
    "from": { "kind": "role", "id": "aircraft-commander" },
    "to": { "kind": "system", "id": "c-17-airlift-aircraft" },
    "interactionType": "Operates",
    "description": "Aircraft Commander is pilot in command of the tasked C-17 sortie.",
    "doctrineSource": [{ "publication": "Aircrew doctrine reference" }]
  },
  {
    "id": "loadmaster-operates-cds-mechanism",
    "from": { "kind": "role", "id": "loadmaster" },
    "to": { "kind": "system", "id": "cds-airdrop-mechanism" },
    "interactionType": "Operates",
    "description": "Loadmaster rigs and releases Container Delivery System (CDS) bundles via the airdrop release mechanism.",
    "doctrineSource": [{ "publication": "DAFMAN 13-217", "section": "Drop-Zone and Landing-Zone Operations" }]
  },
  {
    "id": "aircraft-commander-comms-via-tactical-system",
    "from": { "kind": "role", "id": "aircraft-commander" },
    "to": { "kind": "system", "id": "tactical-communications-system" },
    "interactionType": "CommunicatesVia",
    "description": "Aircraft Commander communicates with Air Traffic Control and ground drop-zone personnel via the tactical communications system.",
    "commsLink": { "mode": "Verbal", "medium": "UHF/VHF AM air-to-ground voice radio net" },
    "doctrineSource": [{ "publication": "AFDP 3-0.1", "note": "General C2/communications-connectivity concept, not a specific real system." }]
  },
  {
    "id": "atc-comms-via-tactical-system",
    "from": { "kind": "role", "id": "air-traffic-controller" },
    "to": { "kind": "system", "id": "tactical-communications-system" },
    "interactionType": "CommunicatesVia",
    "description": "Air Traffic Controller communicates with the tasked aircrew via the tactical communications system.",
    "commsLink": { "mode": "Verbal", "medium": "UHF/VHF AM air-to-ground voice radio net" },
    "doctrineSource": [
      {
        "publication": "AFMAN 13-204 Volume 3, Air Traffic Control",
        "note": "Same verification status as the air-traffic-controller Role record's citation — publication/content confirmed via web search, exact section not independently verified (network-blocked from fetching .mil sources this session)."
      }
    ]
  },
  {
    "id": "dzstl-comms-via-dz-safety-radio-net",
    "from": { "kind": "role", "id": "drop-zone-support-team-leader" },
    "to": { "kind": "system", "id": "dz-safety-of-flight-radio-net" },
    "interactionType": "CommunicatesVia",
    "description": "Drop Zone Support Team Leader communicates with the drop aircraft via UHF/VHF voice radio — limited to safety-of-flight traffic and passing wind/weather, not continuous coordination chatter (see the System record for the doctrinal detail).",
    "commsLink": { "mode": "Verbal", "medium": "UHF/VHF AM voice radio (representative class, e.g. PRC-113-class equipment), line-of-sight air-to-ground" },
    "doctrineSource": [
      {
        "publication": "FM 57-38, Chapter 6, Drop Zones",
        "note": "Corrected 2026-09-07 from a generic 'tactical-communications-system' reference to this more specific dz-safety-of-flight-radio-net System, after researching the actual DZST-to-aircraft radio doctrine in response to a direct question about the communication path and protocol. Same verification status as the dz-safety-of-flight-radio-net System record's citation."
      }
    ]
  },
  {
    "id": "dzstl-comms-via-digital-situational-awareness",
    "from": { "kind": "role", "id": "drop-zone-support-team-leader" },
    "to": { "kind": "system", "id": "digital-situational-awareness-system" },
    "interactionType": "CommunicatesVia",
    "description": "Drop Zone Support Team Leader could plausibly share drop-zone position/marker data via an ATAK-class digital situational awareness capability, complementing the voice radio net. Representative/illustrative only — see the System record's doctrineSource note: no source found this session confirms this is actually used for CDS/airdrop drop-zone coordination.",
    "commsLink": {
      "mode": "Digital",
      "medium": "cellular, satellite, or tactical mesh radio (MANET) — e.g. Persistent Systems Wave Relay- or Silvus-class radios",
      "protocol": "Cursor on Target (CoT) over UDP/TCP",
      "format": "CoT XML event schema (position/marker/zone data)"
    },
    "doctrineSource": [
      {
        "publication": "Android Team Awareness Kit (ATAK) — general program information",
        "note": "Same verification status as the digital-situational-awareness-system System record's citation — general ATAK capability confirmed, application to this specific mission type is NOT confirmed and should not be treated as doctrinal fact."
      }
    ]
  },
  {
    "id": "aircraft-commander-coordinates-with-atc",
    "from": { "kind": "role", "id": "aircraft-commander" },
    "to": { "kind": "role", "id": "air-traffic-controller" },
    "interactionType": "CoordinatesWith",
    "description": "Aircraft Commander coordinates airspace clearance and traffic separation with Air Traffic Control.",
    "doctrineSource": [
      {
        "publication": "AFMAN 13-204 Volume 3, Air Traffic Control",
        "note": "Same verification status as the air-traffic-controller Role record's citation."
      }
    ]
  },
  {
    "id": "loadmaster-coordinates-with-dzstl",
    "from": { "kind": "role", "id": "loadmaster" },
    "to": { "kind": "role", "id": "drop-zone-support-team-leader" },
    "interactionType": "CoordinatesWith",
    "description": "Loadmaster coordinates drop timing and drop-zone readiness with the Drop Zone Support Team Leader before releasing CDS bundles. This is a doctrinal/structural relationship, not a direct radio link — physically, the DZSTL's radio contact is with the flight deck (see dzstl-informs-aircraft-commander-of-dz-status), relayed to the Loadmaster via aircraft intercom (see aircraft-commander-informs-loadmaster-of-release-command).",
    "doctrineSource": [{ "publication": "DAFMAN 13-217", "section": "Drop-Zone and Landing-Zone Operations" }]
  },
  {
    "id": "aircraft-commander-authenticates-to-access-control",
    "from": { "kind": "role", "id": "aircraft-commander" },
    "to": { "kind": "system", "id": "identity-access-control-system" },
    "interactionType": "AuthenticatesTo",
    "description": "Aircraft Commander authenticates to the identity/access-control system to access mission-relevant systems (e.g. tasking and planning data).",
    "commsLink": {
      "mode": "Digital",
      "medium": "DoD enterprise network (representative)",
      "protocol": "PKI/CAC certificate-based authentication",
      "format": "authentication transaction (representative)"
    },
    "doctrineSource": [
      {
        "publication": "DoDI 8520.04, Access Management for DoD Information Systems",
        "note": "General ICAM policy concept only, not a specific real system — same verification status as the identity-access-control-system System record's citation."
      }
    ]
  },
  {
    "id": "aircraft-commander-informs-mission-commander-of-debrief",
    "from": { "kind": "role", "id": "aircraft-commander" },
    "to": { "kind": "role", "id": "mission-commander" },
    "interactionType": "Informs",
    "description": "Following mission execution and recovery, the Aircraft Commander leads the post-mission crew debrief and reports execution results, any discrepancies, and mission outcome to the Mission Commander — the input the Mission Commander's report back through the C2 chain is built from.",
    "commsLink": { "mode": "Verbal", "medium": "in-person, post-mission debrief at the squadron operations/debrief facility" },
    "doctrineSource": [
      {
        "publication": "Aircrew doctrine reference",
        "note": "Post-mission aircrew debrief to the Mission Commander is standard, well-established aircrew practice; not tied to a specific numbered instruction in this dataset — same generic-citation pattern already used for the mission-commander/aircraft-commander/copilot Role records and the mission-commander-commands-aircraft-commander Interaction."
      }
    ]
  },
  {
    "id": "mission-commander-commands-aircraft-commander",
    "from": { "kind": "role", "id": "mission-commander" },
    "to": { "kind": "role", "id": "aircraft-commander" },
    "interactionType": "Commands",
    "description": "Mission Commander holds overall mission execution and decision authority over the tasked sortie, including the Aircraft Commander.",
    "doctrineSource": [
      {
        "publication": "Aircrew doctrine reference",
        "note": "Generic mission-commander concept; not tied to a specific numbered instruction in this dataset — matches the existing mission-commander Role record's citation."
      }
    ]
  },
  {
    "id": "loadmaster-authenticates-to-access-control",
    "from": { "kind": "role", "id": "loadmaster" },
    "to": { "kind": "system", "id": "identity-access-control-system" },
    "interactionType": "AuthenticatesTo",
    "description": "Loadmaster authenticates to the identity/access-control system to access weight-and-balance and load-planning computation tools used to compute center of gravity for the loaded cargo configuration.",
    "commsLink": {
      "mode": "Digital",
      "medium": "DoD enterprise network (representative)",
      "protocol": "PKI/CAC certificate-based authentication",
      "format": "authentication transaction (representative)"
    },
    "doctrineSource": [
      {
        "publication": "DoDI 8520.04, Access Management for DoD Information Systems",
        "note": "General ICAM policy concept only, not a specific real system — same verification status as the identity-access-control-system System record's citation. The specific weight-and-balance/load-planning tool name is not modeled — kept generic/representative rather than naming an unverified real system."
      }
    ]
  },
  {
    "id": "dzstl-informs-aircraft-commander-of-dz-status",